{
  "title": "FIXTURE: country emoji",
  "data": {
    "table": [
      [
        "header"
      ],
      [
        "ch"
      ],
      [
        "abcd"
      ]
    ],
    "metaData": {
      "cells": []
    }
  },
  "sources": [],
  "options": {
    "hideTableHeader": false,
    "showTableSearch": false,
    "cardLayout": false,
    "cardLayoutIfSmall": false,
    "countryFlagColumn": {
      "selectedColumn": 0
    }
  }
}