{
  "title": "FIXTURE: mixed number and text in cell",
  "subtitle": "Opel Insignia Country Tourer 2.0 BiTurbo Diesel",
  "data": {
    "table": [
      [
        "Kennzahl",
        "Wert"
      ],
      [
        "Hubraum",
        "1956 ccm"
      ],
      [
        "Motorbauart",
        "4 Zyl. Reihe, 2 Turbo, Diesel"
      ],
      [
        "Antrieb/Getriebe",
        "AWD/A8"
      ],
      [
        "Leistung",
        "154/210 kW/PS"
      ]
    ],
    "metaData": {
      "cells": []
    }
  },
  "sources": [],
  "options": {
    "hideTableHeader": true,
    "cardLayout": false,
    "cardLayoutIfSmall": false,
    "minibar": {
      "invertColors": false,
      "barColor": {
        "positive": {
          "className": "",
          "colorCode": ""
        },
        "negative": {
          "className": "",
          "colorCode": ""
        }
      },
      "selectedColumn": null
    }
  }
}