{
    "title": "FIXTURE: Heatmap categorical",
    "data": {
        "table": [
            [
                "Kanton",
                "Wert",
                "Wert"
            ],
            [
                "Aargau",
                "etwas",
                "etwas"
            ],
            [
                "Appenzell Ausserrhoden",
                "etwas",
                "etwas"
            ],
            [
                "Appenzell Innerrhoden",
                "etwas",
                "etwas"
            ],
            [
                "Basel-Landschaft",
                "etwas anderes",
                "etwas anderes"
            ],
            [
                "Basel-Stadt",
                "etwas",
                "etwas"
            ],
            [
                "Bern",
                "etwas",
                "etwas"
            ],
            [
                "Freiburg",
                "etwas ganz anderes",
                "etwas ganz anderes"
            ],
            [
                "Genf",
                "etwas anderes",
                "etwas anderes"
            ],
            [
                "Glarus",
                "etwas",
                "etwas"
            ],
            [
                "Graubünden",
                "etwas",
                "etwas"
            ],
            [
                "Jura",
                "etwas",
                "etwas"
            ],
            [
                "Luzern",
                "etwas anderes",
                "etwas anderes"
            ],
            [
                "Neuenburg",
                "etwas anderes",
                "etwas anderes"
            ],
            [
                "Nidwalden",
                "etwas",
                "etwas"
            ],
            [
                "Obwalden",
                "etwas",
                "etwas"
            ],
            [
                "Schaffhausen",
                "etwas",
                "etwas"
            ],
            [
                "Schwyz",
                "etwas",
                "etwas"
            ],
            [
                "Solothurn",
                "etwas ganz anderes",
                "etwas ganz anderes"
            ],
            [
                "St. Gallen",
                "etwas ganz anderes",
                "etwas ganz anderes"
            ],
            [
                "Tessin",
                "etwas",
                "etwas"
            ],
            [
                "Thurgau",
                "etwas",
                "etwas"
            ],
            [
                "Uri",
                "etwas",
                "etwas"
            ],
            [
                "Waadt",
                "etwas",
                "etwas"
            ],
            [
                "Wallis",
                "etwas",
                "etwas"
            ],
            [
                "Zug",
                "etwas",
                "etwas"
            ],
            [
                "Zürich",
                "etwas ganz anderes",
                "etwas ganz anderes"
            ]
        ],
        "metaData": {
            "cells": []
        }
    },
    "sources": [],
    "options": {
        "hideTableHeader": false,
        "showTableSearch": true,
        "cardLayout": false,
        "cardLayoutIfSmall": false,
        "minibar": {
            "invertColors": false,
            "barColor": {
                "positive": {
                    "className": "",
                    "colorCode": ""
                },
                "negative": {
                    "className": "",
                    "colorCode": ""
                }
            },
            "selectedColumn": null
        },
        "heatmap": {
            "noValuesInCell": false,
            "heatmapType": "categorical",
            "numericalOptions": {
                "bucketType": "ckmeans",
                "numberBuckets": 5,
                "scale": "sequential",
                "colorScheme": "one",
                "colorOverwrites": []
            },
            "categoricalOptions": {
                "colorOverwrites": [
                    {
                        "textColor": "light",
                        "color": "darkgrey",
                        "position": 1
                    },
                    {
                        "textColor": "dark",
                        "color": "lightgrey",
                        "position": 2
                    },
                    {
                        "textColor": "dark",
                        "color": "grey",
                        "position": 3
                    }
                ],
                "customCategoriesOrder": [
                    {
                        "category": "etwas ganz anderes"
                    }
                ]
            },
            "selectedColumn": 1
        }
    }
}