{
  "title": "FIXTURE: color column categorical custom colors",
  "data": {
    "table": [
      [
        "String",
        "Number",
        "Number",
        "String"
      ],
      [
        "Test1",
        "1",
        "2.1",
        "Test2"
      ],
      [
        "Test2",
        "2",
        "2.2",
        "Test2"
      ],
      [
        "Test3",
        "3",
        "2.3",
        "Test1"
      ],
      [
        "Test4",
        "4",
        "2.41",
        "Test1"
      ],
      [
        "Test5",
        "5",
        "2.5",
        "Test2"
      ],
      [
        "Test6",
        "6",
        "2.61",
        "Test1"
      ]
    ],
    "metaData": {
      "cells": [
        {
          "data": {
            "footnote": "fussnote"
          },
          "rowIndex": 4,
          "colIndex": 3
        }
      ]
    }
  },
  "sources": [],
  "options": {
    "hideTableHeader": false,
    "showTableSearch": false,
    "cardLayout": false,
    "cardLayoutIfSmall": false,
    "minibar": {
      "invertColors": false,
      "barColor": {
        "positive": {
          "className": "",
          "colorCode": ""
        },
        "negative": {
          "className": "",
          "colorCode": ""
        }
      },
      "selectedColumn": null
    },
    "colorColumn": {
      "colorColumnType": "categorical",
      "numericalOptions": {
        "labelLegend": "noLabel",
        "bucketType": "ckmeans",
        "numberBuckets": 5,
        "scale": "sequential",
        "colorScheme": "one",
        "colorOverwrites": [
          {
            "textColor": "dark",
            "color": "yellow",
            "position": 1
          }
        ]
      },
      "categoricalOptions": {
        "colorOverwrites": [
          {
            "textColor": "dark",
            "color": "pink",
            "position": 1
          },
          {
            "textColor": "dark",
            "color": "lightblue",
            "position": 2
          }
        ],
        "customCategoriesOrder": []
      },
      "selectedColumn": 3
    }
  }
}